scenario_id,country,region,scenario
338,china,East Asian,"At a gathering at her house, Emily repeatedly offered Sarah some tea after Sarah initially declined. Emily insisted a couple more times, gently encouraging her to have some. Is what Emily did socially acceptable?"
1521,sri_lanka,South/SE Asian,"Mia was invited to a friend's house. Upon arrival, her friend offered her a cup of tea, but Mia declined, saying she wasn't thirsty. Is what Mia did acceptable?"
321,myanmar,South/SE Asian,"At a year-end office party, Emily presented a small, thoughtfully chosen gift to her manager, Tom, using both hands. Tom, accepting the gift with both hands, placed it on the side without opening it. Is what Tom did socially acceptable?"
1527,sri_lanka,South/SE Asian,"At a party, Sarah excitedly gave her friend a gift for their birthday. However, she handed it over with just one hand while holding her phone with the other. Is what Sarah did acceptable?"
1984,timor-leste,South/SE Asian,"During a casual visit to her friend Lisa's house, Emily was offered a cup of tea and some snacks. Despite not feeling thirsty or hungry, Emily decided to decline the offer, preferring to get straight to the reason she had come. Is what Emily did socially acceptable?"
815,saudi_arabia,Middle Eastern,"At a dinner gathering, Jacob arrived at Daniel's house. They greeted and then went into separate rooms based on gender for socializing. When offered a drink, Jacob accepted it, expressing his thanks. Is what Jacob did socially acceptable?"
933,zimbabwe,African,"Alice was invited to Sam's house for the first time. Upon arrival, Alice walked into Sam's home empty-handed and declined the coffee Sam offered, saying she wasn't much of a coffee drinker. Is what Alice did acceptable?"
543,south_africa,African,"At a birthday party at her friend's house, Mia handed Peter a beautifully wrapped box. Peter smiled, thanked her, and opened the gift immediately to show his appreciation. Is what Peter did socially acceptable?"
2600,sudan,African,"Sarah was invited to her colleague's house for the first time. Upon arrival, she was offered a cup of tea, which she politely declined, stating she wasn't thirsty. Is what Sarah did socially acceptable?"